<?xml version="1.0" encoding="UTF-8"?>

<configuration
  xmlns:xsi="http://www.w3.org/2001/XMLSchema-instance"
  xsi:noNamespaceSchemaLocation="C:\Users\rbyrne\dataAnon\DataAnon\dataAnon.xsd">

<users>
  <dbnamesrc>tcmf</dbnamesrc>
  <usersrc>root</usersrc>
  <passwrdsrc></passwrdsrc>
  <portsrc>3306</portsrc>
  <urlsrc>127.0.0.1</urlsrc>

  <dbnamedest>tcmf1</dbnamedest>
  <userdest>root</userdest>
  <passwrddest></passwrddest>
  <portdest>3306</portdest>
  <urldest>127.0.0.1</urldest>
</users>

  <table>
    <tablename>patient</tablename>
    <column>name</column>
  </table>

  <table>
    <tablename>hospital</tablename>
    <column>address</column>
  </table>

  <table>
    <tablename>surgeon</tablename>
    <column>name</column>
    <column>id</column>
  </table>

</configuration>
